categoria,descripcion,duracion,comentario
deporte,Torneo de tenis de mesa, 3 semanas, un torneo por llaves que incentiva a los estudiantes a competir de manera sana
deporte, Torneo de ajedrez, 3 horas, Torneo de ajedrez por niveles de conocimiento en el deporte
recreativo, Caminata, 5 horas, Caminata por la naturaleza para relajarse y disfrutar de la naturalezaDeporte y cultura,Torneo Mario Kart,2 horas,Torneo de Mario Kart 8 para todo aquel que quiera participar
Deporte y cultura,Torneo Mario Kart,2 horas,Torneo de Mario Kart 8 para todo aquel que quiera participar
Bienestar,dp,5 horas,relajarse
